id,CleanContent
5,multimodal learning analytics mmla innovations make use rapidly evolving sensing artificial intelligence algorithms collect rich data learning activities unfold physical learning spaces analysis data opening exciting new avenues studying supporting learning yet practical logistical challenges commonly appear deploying mmla innovations inthewild span technical issues related enhancing learning space sensing capabilities increased complexity teachers tasks informed consent practicalities rarely discussed paper addresses gap presenting set lessons learnt year humancentred mmla inthewild study conducted students educators lessons learnt synthesised topics related technologicalphysical aspects deployment ii multimodal data interfaces iii design process iv participation ethics privacy v sustainability deployment
11,important develop sustainable processes materials science manufacturing environmentally friendly ai play significant role decision support evident earlier research leading tools developed using proposed machine learning based approaches tools served purpose computational estimation expert systems research addresses environmental sustainability materials science via decision support agile manufacturing using recycled reclaimed materials safe responsible way turn specific waste stream valueadded products propose use datadriven methods ai applying machine learning models predictive analysis guide decision support manufacturing includes harnessing artificial neural networks study parameters affecting heat treatment materials impacts properties deep learning via advances convolutional neural networks explore grain size detection classifiers random forests analyze phrase fraction detection results methods seem promising embark work eg ann yields accuracy around predicting microstructure development per quench tempering heat treatment process future work entails several challenges investigating various computer vision models vgg resnet etc find optimal accuracy efficiency robustness adequate sustainable processes creating domainspecific tools using machine learning decision support agile manufacturing assessing impacts sustainability metrics incorporating appropriate use recycled materials well effectiveness developed products work makes impacts green technology smart manufacturing motivated related work highly interesting realm ai materials science
34,highly energetic electronhole pairs hot carriers formed plasmon decay metallic nanostructures promise sustainable pathways energyharvesting devices however efficient collection thermalization remains obstacle realization full energy generating potential addressing challenge requires detailed understanding physical processes plasmon excitation metal collection molecule semiconductor atomistic theoretical investigation may particularly beneficial unfortunately firstprinciples theoretical modeling processes extremely costly limiting analysis systems atoms recent advances machine learned interatomic potentials suggest dynamics accelerated surrogate models replace full solution schroedinger equation modify existing neural network hierarchically interacting particle neural network hipnn predict plasmon dynamics ag nanoparticles demonstrate models capability accurately predict plasmon dynamics large nanoparticles atoms present training dataset importantly machine learning models gain speedup times compared rttddft calculations predicting important physical quantities dynamic dipole moments ag times extended nanoparticles times larger underscores promise future machine learning accelerated electronnuclear dynamics simulations understanding fundamental properties plasmondriven hot carrier devices
43,artificial intelligence ai history nearly century inception present day summarized development trends discovered universal rules including success failure analyzed reasons technical philosophical perspectives help understand reasons behind past failures current successes ai provide basis thinking exploring future development specifically found development ai different fields including computer vision natural language processing machine learning follows pattern rules statistics datadriven methods face past failures current successes need think systematically reasons behind given unity ai natural social sciences necessary incorporate philosophical thinking understand solve ai problems believe starting dialectical method marx feasible path concluded sustainable development direction ai humanmachine collaboration technology path centered computing power finally summarized impact ai society trend
45,deep learning experienced significant growth recent years resulting increased energy consumption carbon emission use gpus training deep neural networks dnns answering call sustainability conventional solutions attempted move training jobs locations time frames lower carbon intensity however moving jobs locations may always feasible due large dataset sizes data regulations moreover postponing training negatively impact application service quality dnns backing service updated timely fashion work present practical solution reduces carbon footprint dnn training without migrating postponing jobs specifically solution observes realtime carbon intensity shifts training controls energy consumption gpus thereby reducing carbon footprint maintaining training performance furthermore order proactively adapt shifting carbon intensity propose lightweight machine learning algorithm predicts carbon intensity upcoming time frame solution chase reduces total carbon footprint training resnet imagenet increasing training time
48,farms produce hundreds thousands data points ground daily farming technique combines farming practices insights uncovered data points using ai technology called precision farming precision farming technology augments extends farmers deep knowledge land making production sustainable profitable part larger effort microsoft empowering agricultural labor force productive sustainable paper presents ai technology predicting microclimate conditions farm article chapter publication food agriculture organization united nations international telecommunication union bangkok publication artificial intelligence ai agriculture fifth eagriculture action series launched jointly produced fao itu aims raise awareness existing ai applications agriculture inspire stakeholders develop replicate new ones improvement capacity tools capturing processing data substantial advances field machine learning open new horizons datadriven solutions support decisionmaking facilitate supervision monitoring improve timeliness effectiveness safety measures eg use pesticides support automation many resourceconsuming tasks agriculture publication presents reader collection informative applications highlighting various ways ai used agriculture offering valuable insights implementation process success factors lessons learnt
89,life earth depends healthy oceans supply large percentage planets oxygen food energy however oceans threat climate change devastating marine ecosystem economic social systems depend internetofunderwaterthings iouts global interconnection underwater objects enables roundtheclock monitoring oceans provides highresolution data training machine learning ml algorithms rapidly evaluating potential climate change solutions speeding decisionmaking sensors conventional iouts batterypowered limits lifetime constitutes environmental hazards die paper propose sustainable scheme improve throughput lifetime underwater networks enabling potentially operate indefinitely scheme based simultaneous wireless information power transfer swipt autonomous underwater vehicle auv used data collection model problem jointly maximising throughput harvested power markov decision process mdp develop modelfree reinforcement learning rl algorithm solution models reward function incentivises auv find optimal trajectories maximise throughput power transfer underwater nodes minimising energy consumption best knowledge first attempt using rl ensure sustainable underwater networks via swipt scheme implemented open rl environment specifically developed matlab study performance results show improvement energy efficiency compared random trajectory scheme used baseline model
90,economic issues inflation energy costs taxes interest rates constant presence daily lives exacerbated global events pandemics environmental disasters wars sustained history financial crises reveals significant weaknesses vulnerabilities foundations modern economies another significant issue currently people quitting jobs large numbers moreover many organizations diverse workforce comprising multiple generations posing new challenges transformative approaches economics labour markets needed protect societies economies planet work use big data machine learning methods discover multiperspective parameters multigenerational labour markets parameters academic perspective discovered using article abstracts web science period professionals perspective using linkedin posts discover total parameters categorised macroparameters learning skills employment sectors consumer industries learning employment issues generationsspecific issues complete machine learning software tool developed datadriven parameter discovery variety quantitative visualisation methods applied multiple taxonomies extracted explore multigenerational labour markets knowledge structure literature review multigenerational labour markets using research articles provided expected work enhance theory practice aibased methods knowledge discovery system parameter discovery develop autonomous capabilities systems promote novel approaches labour economics markets leading development sustainable societies economies
97,cloud platforms increasingly emphasizing sustainable operations order reduce operational carbon footprint one approach reducing emissions exploit temporal flexibility inherent many cloud workloads executing time periods greenest electricity supply suspending times since suspendresume approaches incur long delays job completion times present new approach exploits workload elasticity batch workloads cloud optimize carbon emissions approach based notion carbon scaling similar cloud autoscaling jobs server allocations varied dynamically based fluctuations carbon cost grids electricity supply present optimal greedy algorithm minimizing jobs emissions carbon scaling implement prototype systemname system kubernetes using autoscaling capabilities along analytic tool guide carbonefficient deployment batch applications cloud evaluate carbonscaler using realworld machine learning training mpi jobs commercial cloud platform show systemname yield carbon savings carbon agnostic execution stateoftheart suspend resume policies
112,electrical substations becoming prone cyberattacks due increasing digitalization prevailing defense measures based cyber rules often inadequate detect attacks use legitimatelooking measurements work design implement bad data detection solution electrical substations called resigate effectively combines physicsbased approach machinelearningbased approach provide substantial speedup highthroughput substation communication scenarios still maintaining high detection accuracy confidence many existing physicsbased schemes designed deployment control centers due high computational requirement resigate designed security appliance deployed lowcost industrial computers edge smart grid detect local substationlevel attacks timely manner key challenge continuously run computationally demanding physicsbased analysis monitor measurement data frequently transmitted typical substation provide high throughput without sacrificing accuracy resigate uses machine learning effectively filter nonsuspicious normal data thereby reducing overall computational load allowing efficient performance even high volume network traffic implement resigate lowcost industrial computer experiments confirm resigate detect attacks zero error sustaining high throughput
137,nowadays proper urban waste management one biggest concerns maintaining green clean environment automatic waste segregation system viable solution improve sustainability country boost circular economy paper proposes machine segregate waste different parts help smart object detection algorithm using convowaste field deep convolutional neural networks dcnn image processing techniques paper deep learning image processing techniques applied precisely classify waste detected waste placed inside corresponding bins help servo motorbased system machine provision notify responsible authority regarding waste level bins time trash bins filled garbage using ultrasonic sensors placed bin dualband gsmbased communication technology entire system controlled remotely android app order dump separated waste desired place thanks automation properties use system aid process recycling resources initially destined become waste utilizing natural resources turning resources back usable products thus system helps fulfill criteria circular economy resource optimization extraction finally system designed provide services low cost maintaining high level accuracy terms technological advancement field artificial intelligence ai gotten accuracy convowaste deep learning model
148,network robustness critical various industrial social networks malicious attacks various meanings different research contexts refers ability network sustain functionality fraction network fail work due attacks rapid development complex networks research indicates special interest great concern network robustness essential analyzing optimizing network structures towards engineering applications comprehensive survey distills important findings developments network robustness research focusing posteriori structural robustness measures singlelayer static networks specifically posteriori robustness measures reviewed four perspectives network functionality including connectivity controllability communication ability well extensions malicious attacks including conventional computationbased attack strategies robustness estimation methods using either analytical approximation machine learningbased prediction network robustness optimization based existing measures practical threshold network destruction introduced suggestion network robustness measured reaching threshold destruction posteriori priori measures compared experimentally revealing advantages posteriori measures finally prospective research directions respect posteriori robustness measures recommended
154,longterm focused attention visualization breathing exercises core various eastern traditions neurocognitive psychosomatic phenomena demonstrated exercises instrumentally explored eeg sensors neurocognitive modeling form meditative visualization produced persistent temperature effects body long exercise finished raises question psychosomatic biophysical origin work explores question comparing experiments focusing attention inside outside body eeg temperature heart breathing sensors monitor internal body conditions high resolution differential calorimetric sensors used detect thermal effects outside body experiments attempts operatorsensor sessions carried five months control measurements run conditions parallel experimental series increase body temperature moderate fever zone c intentional control trend core temperature c demonstrated persistent temperature variations last min experiments also demonstrated induced thermal fluctuations c level external calorimetric systems ml water min repeatability attempts statistical chisquare mannwhitney tests reject null hypotheses random character outcomes thus obtained data confirm persistent thermal effects reported previous publications indicate biophysical dimension explain results refer new model neuroscience involves spin phenomena biochemical physical systems experiments demonstrate complex biophysical mechanisms altered states consciousness function bodys neurohumoral regulation nonclassical brain functions discussed
157,plant biomass estimation critical due variability different environmental factors crop management practices associated assessment largely impacted accurate prediction different environmental sustainability indicators robust model predict sustainability indicators must biomass community study proposes robust model biomass sustainability prediction analyzing sustainability indicators using machine learning models prospect ensemble learning also investigated analyze regression problem experiments carried crop residue data ohio state ten machine learning models namely linear regression ridge regression multilayer perceptron knearest neighbors support vector machine decision tree gradient boosting random forest stacking voting analyzed estimate three biomass sustainability indicators namely soil erosion factor soil conditioning index organic matter factor performance model assessed using crosscorrelation r root mean squared error mean absolute error metrics results showed random forest best performing model assess sustainability indicators analyzed model serve guide assessing sustainability indicators real time
170,domainspecific machine learning ml accelerators googles tpu apples neural engine dominate cpus gpus energyefficient ml processing however evolution electronic accelerators facing fundamental limits due limited computation density monolithic processing chips reliance slow metallic interconnects paper present vision optical computation communication integrated chiplet platforms drive entirely new class sustainable scalable ml hardware accelerators describe crosslayer design fabrication optical devices circuits architectures hardwaresoftware codesign help design efficient photonicsbased chiplet platforms accelerate emerging ml workloads
179,sustained growth carbon emissions global waste elicits significant sustainability concerns environments future growing internet things iot potential exacerbate issue however emerging area known tiny machine learning tinyml opportunity help address environmental challenges sustainable computing practices tinyml deployment machine learning ml algorithms onto lowcost lowpower microcontroller systems enables ondevice sensor analytics unlocks numerous alwayson ml applications article discusses potential tinyml applications address critical sustainability challenges moreover footprint emerging technology assessed complete life cycle analysis tinyml systems analysis tinyml presents opportunities offset carbon emissions enabling applications reduce emissions sectors nevertheless globally scaled carbon footprint tinyml systems negligible necessitating designers factor environmental impact formulating new devices finally research directions enabling opportunities tinyml contribute sustainable future outlined
180,research practice artificial intelligence ai grow leaps bounds resources necessary sustain support operations also grow increasing pace innovations applications ai brought significant advances applications vision natural language improvements fields like medical imaging materials engineering costs neglected embrace world everincreasing amounts data well research development ai applications sure face evermounting energy footprint sustain computational budgets data storage needs sustainable importantly kind setting best positioned nurture sustainable ai research practice paper outline outlook green ai sustainable energyefficient energyaware ecosystem developing ai across research computing practitioner communities alike steps required arrive present birds eye view various areas potential changes improvements ground floor ais operational hardware optimizations datacentershpcs current incentive structures world ai research practice hope points spur discussion action issues potential solutions
182,growing landscape emerging wireless applications key driver toward development novel wireless system designs design based metaverse uses virtual model physical world systems along schemestechnologies eg optimization theory machine learning blockchain metaverse using virtual model performs proactive intelligent analytics prior user request efficient management wireless system resources additionally metaverse enable selfsustainability operate wireless systems least possible intervention network operators although metaverse offer many benefits faces challenges well therefore tutorial discuss role metaverse enabling wireless applications present overview key enablers design aspects ie metaverse wireless wireless metaverse novel highlevel architecture metaversebased wireless systems discuss metaverse management reliability security metaversebased system furthermore discuss recent advances standardization metaverseenabled wireless system finally outline open challenges present possible solutions
200,quality education one seventeen sustainable development goals sdgs identified united nations general assembly stands benefit enormously adoption artificial intelligence ai driven tools technologies concurrent boom necessary infrastructure digitized data general social awareness propelled massive research development efforts artificial intelligence education aied sector review article investigate artificial intelligence machine learning deep learning methods utilized support students educators administrative staff lens novel categorization approach consider involvement aidriven methods education process entirety students admissions course scheduling etc proactive planning phase knowledge delivery performance assessment etc reactive execution phase outline analyze major research directions proactive reactive engagement ai education using representative group original research articles published past two decades ie discuss paradigm shifts solution approaches proposed ie choice data algorithms used time dive covid pandemic challenged reshaped education landscape fag end time period finally pinpoint existing limitations adopting artificial intelligence education reflect path forward
205,modernday society demands resilient reliable smart urban infrastructure effective telligent operations deployment however unexpected highimpact lowprobability events earthquakes tsunamis tornadoes hurricanes make design robust infrastructure complex result events power system infrastructure severely affected leading unprecedented events blackouts nevertheless integration smart grids existing framework smart cities adds resilience therefore designing resilient reliable power system network inevitable requirement modern smart city infras tructure deployment internet things iot smart cities infrastructures taken transformational turn towards introducing technologies provide ease comfort citizens also feasible terms sustainability dependability paper presents holistic view resilient sustainable smart city architecture utilizes iot big data analytics unmanned aerial vehicles smart grids intelligent integration renew able energy resources addition impact disasters power system infrastructure investigated different types optimization techniques used sustain power flow network disturbances compared analyzed furthermore comparative review analysis different datadriven machine learning techniques sustainable smart cities performed along discussion open research issues challenges
228,android operating system pervasively adopted operating system platform choice smart devices however strong adoption also resulted exponential growth number android based malicious software malware deal cyber threats part cyber investigation digital forensics computational techniques form machine learning algorithms applied malware identification detection forensics analysis however computational forensics modelling techniques constrained volume velocity variety veracity malware landscape turn would affect identification detection effectiveness consequence would inherently induce question sustainability solution approach one approach optimise effectiveness apply dimensional reduction techniques like principal component analysis intent enhance algorithmic performance paper evaluate effectiveness application principle component analysis computational forensics task detecting android based malware applied research hypothesis three different datasets different machine learning algorithms research result showed dimensionally reduced dataset would result measure degradation accuracy performance
254,advancements machine learning ml methods compute resources artificial intelligence ai empowered systems becoming prevailing technology however current ai technology deep learning flawless significantly increased model complexity data scale incur intensified challenges lacking trustworthiness transparency could create new risks negative impacts paper carve ai maintenance robustness perspective start introducing highlighted robustness challenges ai lifecycle motivating ai maintenance making analogies car maintenance propose ai model inspection framework detect mitigate robustness risks also draw inspiration vehicle autonomy define levels ai robustness automation proposal ai maintenance facilitates robustness assessment status tracking risk scanning model hardening regulation throughout ai lifecycle essential milestone toward building sustainable trustworthy ai ecosystems
