id,CleanContent
262,understanding forest health great importance conservation integrity forest ecosystems monitoring forest health therefore indispensable longterm conservation forests sustainable management regard evaluating amount quality dead wood utmost interest favorable indicators biodiversity apparently remote sensingbased machine learning techniques proven efficient sustainable unprecedented accuracy forest inventory however application techniques still infancy respect dead wood mapping study investigates first time automatic classification individual coniferous trees five decay stages live declining dead loose bark clean combined airborne laser scanning als point clouds cir images using three machine learning methods point cloudbased deep learning pointnet convolutional neural network cnn random forest rf models achieved promising results reaching overall accuracy oa cnn rf pointnet respectively experimental results reveal imagebased approach notably outperformed point cloudbased one spectral image texture highest relevance success categorizing tree decay models could therefore used automatic determination single tree decay stages landscapewide assessment dead wood amount quality using modern airborne remote sensing techniques machinedeep learning proposed method contribute important rigorous tool monitoring biodiversity forest ecosystems
269,recent increase public academic interest preserving biodiversity led growth field conservation technology field involves designing constructing tools utilize technology aid conservation wildlife article use case studies demonstrate importance designing conservation tools humanwildlife interaction mind provide framework creating successful tools case studies include range complexities simple cat collars machine learning game theory methodologies goal introduce inform current future researchers field conservation technology provide references educating next generation conservation technologists conservation technology potential benefit biodiversity also broader impacts fields sustainability environmental protection using innovative technologies address conservation challenges find effective efficient solutions protect preserve planets resources
305,handwritten character recognition hot topic research nowadays convert handwritten piece paper textsearchable document using optical character recognition ocr technique easily understand content need read handwritten document ocr english language common bengali language hard find good quality ocr application merge machine learning deep learning ocr could huge contribution field various researchers proposed number strategies recognizing bengali handwritten characters lot ml algorithms deep neural networks used work explanations models available work used various machine learning algorithms cnn recognize handwritten bengali digits got acceptable accuracy ml models cnn given us great testing accuracy gradcam used xai method cnn model gave us insights model helped us detect origin interest recognizing digit image
316,evolution wireless communications g beyond expected rely new machine learning mlbased capabilities enable proactive decisions actions wirelessnetwork components sustain qualityofservice qos user experience moreover new use cases area vehicular industrial communications emerge specifically area vehicle communication vehicletoeverything vx schemes benefit strongly advances mind conducted detailed measurement campaign purpose enabling plethora diverse mlbased studies resulting datasets offer gpslocated wireless measurements across diverse urban environments cellular two different operators sidelink radio access technologies thus enabling variety different studies towards vx datasets labeled sampled high time resolution furthermore make data publicly available necessary information support onboarding new researchers provide initial analysis data showing challenges ml needs overcome features ml leverage well hints potential research studies
340,availability challenging benchmarks played key role recent progress machine learning cooperative multiagent reinforcement learning starcraft multiagent challenge smac become popular testbed centralised training decentralised execution however years sustained improvement smac algorithms achieve nearperfect performance work conduct new analysis demonstrating smac sufficiently stochastic require complex closedloop policies particular show openloop policy conditioned timestep achieve nontrivial win rates many smac scenarios address limitation introduce smacv new version benchmark scenarios procedurally generated require agents generalise previously unseen settings distribution evaluation show changes ensure benchmark requires use closedloop policies evaluate stateoftheart algorithms smacv show presents significant challenges present original benchmark analysis illustrates smacv addresses discovered deficiencies smac help benchmark next generation marl methods videos training available httpssitesgooglecomviewsmacv
355,climate change population growth water scarcity present unprecedented challenges agriculture project aims forecast soil moisture using domain knowledge machine learning crop management decisions enable sustainable farming traditional methods predicting hydrological response features require significant computational time expertise recent work implemented machine learning models tool forecasting hydrological response features models neglect crucial component traditional hydrological modeling spatially close units vastly different hydrological responses traditional hydrological modeling units similar hydrological properties grouped together share model parameters regardless spatial proximity inspired domain knowledge constructed novel domaininspired temporal graph convolution neural network approach involves clustering units based timevarying hydrological properties constructing graph topologies cluster forecasting soil moisture using graph convolutions gated recurrent neural network trained validated tested method fieldscale time series data consisting approximately hydrological response units spanning years case study northeastern united states comparison existing models illustrates effectiveness using domaininspired clustering time series graph neural networks framework deployed part pro bono social impact program trained models deployed smallholding farms central texas
359,use deep learning computer vision tasks image classification led rapid increase performance systems due substantial increment utility systems use artificial intelligence many critical tasks exploded medical domain medical image classification systems adopted due high accuracy near parity human physicians many tasks however artificial intelligence systems extremely complex considered black boxes scientists due difficulty interpreting exactly led predictions made models systems used assist highstakes decisionmaking extremely important able understand verify justify conclusions reached model research techniques used gain insight blackbox models field explainable artificial intelligence xai paper evaluated three different xai methods across two convolutional neural network models trained classify lung cancer histopathological images visualized outputs analyzed performance methods order better understand apply explainable artificial intelligence medical domain
382,paper evaluates machine learning ml establishing ratemaking new insurance schemes make evaluation feasible established expected indemnities premiums use ml forecast indemnities using minimum set variables analysis simulates introduction income insurance scheme socalled income stabilization tool ist italy case study using farmlevel data fadn predicted expected ist indemnities using three ml tools lasso elastic net boosting perform variable selection comparing generalized linear model baseline usually adopted insurance investigations furthermore tweedie distribution implemented consider peculiarity shape indemnities function characterized zeroinflated nonegative value asymmetric fattail robustness results evaluated comparing econometric economic performance models specifically ml obtained best goodnessoffit baseline using small stable selection regressors significantly reducing gathering cost information however boosting enabled obtain best economic performance balancing minor risky subjects optimally achieving good economic sustainability findings suggest machine learning successfully applied agricultural insurancethis study represents one first use ml tweedie distribution agricultural insurance demonstrating potential overcome multiple issues
391,californias central valley national agricultural center producing nations food however land central valley sinking rapid rate much cm per year due continued groundwater pumping land subsidence significant impact infrastructure resilience groundwater sustainability study aim identify specific regions different temporal dynamics land displacement find relationships underlying geological composition aim remotely estimate geologic composition using interferometric synthetic aperture radar insarbased land deformation temporal changes using machine learning techniques identified regions different temporal characteristics land displacement areas eg helm coarser grain geologic compositions exhibited potentially reversible land deformation elastic land compaction found significant correlation insarbased land deformation geologic composition using random forest deep neural network regression models also achieved significant accuracy sparse sampling reduce spatial correlations among data suggesting model potential generalized regions indirect estimation geologic composition results indicate geologic composition estimated using insarbased land deformation data insitu measurements geologic composition expensive time consuming may impractical areas generalizability model sheds light high spatial resolution geologic composition estimation utilizing existing measurements
395,make machine learning ml sustainable apt run diverse devices relevant data essential compress ml models needed still meeting required learning quality time performance however much ml model compressed em training executed hard decisions make depend model resources available nodes data nodes existing studies focus aspects individually however account decisions made jointly adapted one another work model network system focusing training dnns formalize multidimensional problem given nphardness formulate approximate dynamic programming problem solve pact algorithmic framework importantly pact leverages timeexpanded graph representing learning process datadriven theoretical approach prediction loss evolution expected consequence training decisions prove pacts solutions get close optimum desired cost increased time complexity case complexity polynomial numerical results also show even disadvantageous settings pact outperforms stateoftheart alternatives closely matches optimal energy cost
418,investing children youth critical step towards inclusive equitable sustainable development current future generations several international agendas accomplishing common global goals emphasize need active youth participation engagement sustainable development agenda sustainable development emphasizes need youth engagement inclusion youth perspectives important step toward addressing sustainable development goals aim study analyze youth perspectives values sentiments towards issues addressed sustainable development goals social network analysis using machine learning social network data collected major sustainability conferences aimed engaging children youth analyzed using natural language processing techniques sentiment analysis data categorized using natural language processing text classifier trained sample dataset social network data youth sustainability conferences deeper understanding youth perspectives relation sdgs machine learning identified demographic location attributes features utilized order identify bias demographic differences ages gender race among youth using natural language processing qualitative data collected different countries languages systematically translated categorized analyzed revealing key trends focus areas sustainable youth development policies obtained results reveal general youths depth knowledge sustainable development attitudes towards sdgs findings study serve guide toward better understanding interests roles perspectives children youth achieving goals agenda
423,multilabel classification mlc task increasingly receiving interest machine learning ml community evidenced growing number papers methods appear literature hence ensuring proper correct robust trustworthy benchmarking utmost importance development field believe achieved adhering recently emerged data management standards fair findable accessible interoperable reusable trust transparency responsibility user focus sustainability technology principles fairify mlc datasets introduce ontologybased online catalogue mlc datasets follow principles catalogue extensively describes many mlc datasets comprehensible metafeatures mlcspecific semantic descriptions different data provenance information mlc data catalogue extensively described recent publication nature scientific reports kostovska bogatinovski et al available httpsemantichubijssimlcdatasets addition provide ontologybased system easy access querying performancebenchmark data obtained comprehensive mlc benchmark study system available httpsemantichubijssimlcbenchmark
425,big streams earth images satellites platforms eg drones mobile phones becoming increasingly available low cost enhanced spatial temporal resolution thesis recognizes unprecedented opportunities offered high quality open access earth observation data times introduces novel machine learning big data methods properly exploit towards developing applications sustainable resilient agriculture thesis addresses three distinct thematic areas ie monitoring common agricultural policy cap monitoring food security applications smart resilient agriculture methodological innovations developments related three thematic areas address following issues processing big earth observation eo data ii scarcity annotated data machine learning model training iii gap machine learning outputs actionable advice thesis demonstrated big data technologies data cubes distributed learning linked open data semantic enrichment used exploit data deluge extract knowledge address real user needs furthermore thesis argues importance semisupervised unsupervised machine learning models circumvent everpresent challenge scarce annotations thus allow model generalization space time specifically shown merely ground truth data needed generate high quality crop type maps crop phenology estimations finally thesis argues considerable distance value model inferences decision making realworld scenarios thereby showcases power causal interpretable machine learning bridging gap
453,learning analytics la data collection analysis representation data learners order improve learning performance furthermore la opens door opportunities selfregulated learning higher education circular process learners activate sustain behaviours oriented toward personal learning goals potentials la selfregulated learning huge however yet widely applied higher education institutions slovenian higher education institutions lagged behind european countries la adoption research aims fill gap using qualitatively quantitatively led workflow building requirementoriented la solution consisting empirically gathering students expectations la presenting dashboard solution translated student expectations learning analytics questionnaire focus groups used gather expectations learners based user interface utilizing la grade prediction ai model implemented selected course interface includes early grade prediction peer comparison historical data overview grade prediction based machine learning model built users interaction virtual learning environment demographic data lab grades first classification used determine students risk failing precision reaches first month course second exact grade predicted decision tree regressor reaching mean absolute error grade points points scale first month proposed systems main benefit support selfregulation learning process semester possibly motivating students adjust learning strategies prevent failing course initial student evaluation showed positive results
456,nowadays broadly recognized power system community meet ever expanding energy sectors needs longer possible rely solely physicsbased models reliable timely sustainable operation energy systems impossible without systematic integration artificial intelligence ai tools nevertheless adoption ai power systems still limited integration ai particularly distribution grid investment planning still uncharted territory make first step forward bridge gap showing graph convolutional networks coupled hyperstructures representation learning framework employed accurate reliable computationally efficient distribution grid planning resilience objectives propose hyperstructures graph convolutional neural networks hypergcnns capture hidden higher order representations distribution networks attention mechanism numerical experiments show proposed hypergcnns approach yields substantial gains computational efficiency compared prevailing methodology distribution grid planning also noticeably outperforms seven stateoftheart models deep learning dl community
464,automatic speech quality assessment essential audio researchers developers speech language pathologists system quality engineers current stateoftheart systems based framewise speech features handengineered learnable combined time dependency modeling paper proposes efficient system results comparable best performing model conferencingspeech challenge proposed system characterized smaller number parameters x fewer flops x lower memory consumption x lower latency x speech quality practitioners therefore iterate much faster deploy system resourcelimited hardware overall proposed system contributes sustainable machine learning paper also concludes framewise embeddings outperform utterancelevel embeddings multitask training acoustic conditions modeling degrade speech quality prediction providing better interpretation
465,agriculture heart solution achieve sustainability feeding world population advancing understanding agricultural output responds climatic variability still needed precision agriculture pa management strategy uses technology remote sensing geographical information system gis machine learning decision making field emerged promising approach enhance crop production increase yield reduce water nutrient losses environmental impacts context multiple models predict agricultural phenotypes crop yield genomics g environment e weather soil field management practices developed models traditionally based mechanistic statistical approaches however ai approaches intrinsically wellsuited model complex interactions recently developed outperforming classical methods present natural language processing nlpbased neural network architecture process g e inputs interactions show modeling dna natural language approach performs better previous approaches tested new environments similarly approaches unseen seed varieties
475,training facial emotion recognition models requires large sets data costly annotation processes alleviate problem developed gamified method acquiring annotated facial emotion data without explicit labeling effort humans game named facegame challenges players imitate displayed image face portrays particular basic emotion every round played player creates new data consists set facial features landmarks already annotated emotion label target facial expression approach effectively creates robust sustainable continuous machine learning training process evaluated facegame experiment revealed several contributions field affective computing first gamified data collection approach allowed us access rich variation facial expressions basic emotion due natural variations players facial expressions expressive abilities report improved accuracy collected data used enrich wellknown inthewild facial emotion datasets consecutively used training facial emotion recognition models second natural language prescription method used facegame constitutes novel approach interpretable explainability applied facial emotion recognition model finally observed significant improvements facial emotion perception expression skills players repeated game play
478,fairness environmental impact important research directions sustainable development artificial intelligence however topic active research area natural language processing nlp surprising lack research interplay two fields lacuna highly problematic since increasing evidence exclusive focus fairness actually hinder environmental sustainability vice versa work shed light crucial intersection nlp investigating efficiency current fairness approaches surveying example methods reducing unfair stereotypical bias literature evaluating common technique reduce energy consumption thus environmental impact english nlp models knowledge distillation kd impact fairness case study evaluate effect important kd factors including layer dimensionality reduction respect performance distillation task natural language inference semantic similarity prediction b multiple measures dimensions stereotypical bias eg gender bias measured via word embedding association test results lead us clarify current assumptions regarding effect kd unfair bias contrary findings show kd actually decrease model fairness
488,metaverse iteratively defined potential unleash next wave digital disruption create reallife value becomes increasingly clear distinctive features immersive experience simultaneous interactivity user agency metaverse capability transform walks life however enabling technologies metaverse ie digital twin artificial intelligence blockchain extended reality known energyhungry therefore raising concerns sustainability largescale deployment development article proposes green metaverse networking first time optimize energy efficiencies network components metaverse sustainable development first analyze energy consumption efficiency sustainability energyintensive technologies metaverse next focusing computation networking present major advancements related energy efficiency integration metaverse case study energy conservation incorporating semantic communication stochastic resource allocation metaverse presented finally outline critical challenges metaverse sustainable development thereby indicating potential directions future research towards green metaverse
500,twodimensional materials supported single atom catalysis sacs foreseen replace platinum largescale industrial scalability sustainable hydrogen generation series metal al sc ti v cr mn fe ni cu zn nonmetal b c n f si p cl single atoms embedded various active sites gcn screened dft calculations six machine learning ml algorithms support vector regression gradient boosting regression random forest regression adaboost regression multilayer perceptron regression ridge regression results based formation energy gibbs free energy bandgap analysis demonstrate single atoms b mn co anchored gcn serve highly efficient active sites hydrogen production ml model based support vector regression svr exhibits best performance accurately rapidly predict gibbs free energy hydrogen adsorption deltagh test set lower mean absolute error mae high coefficient determination r respectively feature selection based svr model highlights top five primary features formation energy bond length boiling point melting point valance electron key descriptors overall multistep workflow employed dft calculations combined ml models efficient screening potential hydrogen evolution reaction gcnbased single atom catalysis significantly contribute catalyst design fabrication
506,food protein digestibility bioavailability critical aspects addressing human nutritional demands particularly seeking sustainable alternatives animalbased proteins study propose machine learning approach predict true ileal digestibility coefficient food items model makes use unique curated dataset combines nutritional information different foods fasta sequences protein families extracted biochemical properties proteins combined properties embeddings transformerbased protein language model plm addition used shap identify features contribute model prediction provide interpretability first aibased model predicting food protein digestibility accuracy compared existing experimental techniques accuracy model eliminate need lengthy invivo invitro experiments making process creating new foods faster cheaper ethical
510,maintaining roadway infrastructure one essential factors enabling safe economic sustainable transportation system manual roadway damage data collection laborious unsafe humans perform area poised benefit rapid advance diffusion artificial intelligence technologies specifically deep learning advancements enable detection road damages automatically collected road images work proposes collect label road damage data using google street view use yolov look version together coordinate attention related accuracy finetuning techniques label smoothing ensemble method train deep learning models automatic road damage detection classification proposed approaches applied crowdsensingbased road damage detection challenge crddc ieee bigdata results show data collection google street view efficient proposed deep learning approach results f scores road damage data collected united states using google street view test images dataset
