id,CleanContent
514,numerous research recently proposed integrating federated learning fl address privacy concerns using machine learning privacysensitive firms however standards available frameworks longer sustain rapid advancement hinder integration fl solutions prominent advancing field paper propose modularfed researchfocused framework addresses complexity fl implementations lack adaptability extendability available frameworks provide comprehensive architecture assists fl approaches welldefined protocols cover three dominant fl paradigms adaptable workflow datasets distribution thirdparty application support within architecture protocols blueprints strictly define frameworks components design contribute flexibility strengthen infrastructure protocols aim enable modularity fl supporting thirdparty plugandplay architecture dynamic simulators coupled major builtin data distributors field additionally framework support wrapping multiple approaches single environment enable consistent replication fl issues clients deficiency data distribution network latency entails fair comparison techniques outlying fl technologies evaluation examine applicability framework addressing three major fl domains including statistical distribution modularbased approaches resource monitoring client selection
523,today ongoing transition sustainable transportation essential part transition switch combustion engine vehicles battery electric vehicles bevs bevs many advantages sustainability perspective issues limited driving range long recharge times slow transition combustion engines one way mitigate issues performing battery thermal preconditioning increases energy efficiency battery however optimally perform battery thermal preconditioning vehicle usage pattern needs known ie vehicle used study attempts predict departure time distance first drive day using different online machine learning models online machine learning models trained evaluated historical driving data collected fleet bevs covid pandemic additionally prediction models extended quantify uncertainty predictions used guidance whether prediction used dismissed show bestperforming prediction models yield aggregated mean absolute error hours predicting departure time km predicting trip distance
539,metaverse expected emerge new paradigm nextgeneration internet providing fully immersive personalised experiences socialize work play selfsustaining hyperspatiotemporal virtual worlds advancements different technologies like augmented reality virtual reality extended reality xr artificial intelligence ai gg communication key enablers behind realization aixr metaverse applications ai many potential applications aforementioned technologies eg avatar generation network optimization etc ensuring security ai critical applications like aixr metaverse applications profoundly crucial avoid undesirable actions could undermine users privacy safety consequently putting lives danger end attempt analyze security privacy trustworthiness aspects associated use various ai techniques aixr metaverse applications specifically discuss numerous challenges present taxonomy potential solutions could leveraged develop secure private robust trustworthy aixr applications highlight real implications aiassociated adversarial threats designed metaversespecific case study analyzed adversarial lens finally elaborate upon various open issues require research interest community
547,web artificial intelligence technologies especially semantic web knowledge graph kg recently raised significant attention educational scenarios nevertheless subjectspecific kgs k education still lack sufficiency sustainability knowledge data perspectives tackle issues propose edukg heterogeneous sustainable k educational knowledge graph first design interdisciplinary finegrained ontology uniformly modeling knowledge resource k education define classes object properties datatype properties total guided ontology propose flexible methodology interactively extracting factual knowledge textbooks furthermore establish general mechanism based proposed generalized entity linking system edukgs sustainable maintenance dynamically index numerous heterogeneous resources data knowledge topics edukg evaluate edukg illustrate sufficiency richness variability publish edukg million entities billion triplets code data repository available httpsgithubcomthukegedukg
554,properties electrons matter fundamental importance give rise virtually molecular material properties determine physics play objects ranging semiconductor devices interior giant gas planets modeling simulation diverse applications rely primarily density functional theory dft become principal method predicting electronic structure matter dft calculations proven useful point recognized nobel prize computational scaling limits small systems developed machine learning framework predicting electronic structure length scale shows three orders magnitude speedup systems dft tractable importantly enables predictions scales dft calculations infeasible work demonstrates machine learning circumvents longstanding computational bottleneck advances science frontiers intractable current solutions unprecedented modeling capability opens inexhaustible range applications astrophysics novel materials discovery energy solutions sustainable future
562,transitioning fossil fuels renewable energy sources critical global challenge demands advances levels materials devices systems efficient harvesting storage conversion management renewable energy researchers globally begun incorporating machine learning ml techniques aim accelerating advances ml technologies leverage statistical trends data build models prediction material properties generation candidate structures optimization processes among uses result incorporated discovery development pipelines accelerate progress review recent advances mldriven energy research outline current future challenges describe required moving forward best lever ml techniques start give overview key ml concepts introduce set key performance indicators help compare benefits different mlaccelerated workflows energy research discuss evaluate latest advances applying ml development energy harvesting photovoltaics storage batteries conversion electrocatalysis management smart grids finally offer outlook potential research areas energy field stand benefit application ml
564,artificial intelligence ai revolutionizing many areas lives leading new era technological advancement particularly transportation sector would benefit progress ai advance development intelligent transportation systems building intelligent transportation systems requires intricate combination artificial intelligence mobility analysis past years seen rapid development transportation applications using advanced deep neural networks however deep neural networks difficult interpret lack robustness slows deployment aipowered algorithms practice improve usability increasing research efforts devoted developing interpretable robust machine learning methods among causal inference approach recently gained traction provides interpretable actionable information moreover methods developed image sequential data satisfy specific requirements mobility data analysis vision paper emphasizes research challenges deep learningbased mobility analysis require interpretability robustness summarizes recent developments using causal inference improving interpretability robustness machine learning methods highlights opportunities developing causallyenabled machine learning models tailored mobility analysis research direction make ai transportation sector interpretable reliable thus contributing safer efficient sustainable future transportation systems
582,examine computational energy requirements different systems driven geometrical scaling law increasing use artificial intelligence machine learning aiml last decade scientific technology applications based datadriven discovery machine learning methods especially deep neural networks become widely used order enable applications hardware accelerators advanced aiml methods led introduction new architectures system designs algorithms software analysis energy trends indicates three important observations energy efficiency due geometrical scaling slowing energy efficiency bitlevel translate efficiency instructionlevel systemlevel variety systems especially largescale aiml accelerators supercomputers application level generalpurpose aiml methods computationally energy intensive offsetting gains energy geometrical scaling special purpose accelerators analysis provides specific pointers integrating energy efficiency performance analysis enabling highperformance sustainable computing future
583,location based services already popular end users inevitably becoming part new wireless infrastructures emerging business processes increasingly popular deep learning dl artificial intelligence methods perform well wireless fingerprinting localization based extensive indoor radio measurement data however increasing complexity methods become computationally intensive energy hungry training subsequent operation considering mobile users estimated exceed billion end assuming networks serving users need perform one localization per user per hour average machine learning models used calculation would need perform times predictions per year add equation tens billions connected devices applications rely heavily frequent location updates becomes apparent localization contribute significantly carbon emissions unless energyefficient models developed used chapter discuss latest results trends wireless localization look paths towards achieving sustainable ai elaborate methodology computing dl model complexity energy consumption carbon footprint show concrete example develop resourceaware model fingerprinting finally compare relevant works terms complexity training co footprint
602,recently trend shifting execution deep learning inference tasks toward edge network closer user reduce latency preserve data privacy time growing interest devoted energetic sustainability machine learning intersection trends hence find energetic characterization machine learning edge attracting increasing attention unfortunately calculating energy consumption given neural network inference complicated heterogeneity possible underlying hardware implementation work hence aim profiling energetic consumption inference tasks modern edge nodes deriving simple realistic models end performed large number experiments collect energy consumption convolutional fully connected layers two wellknown edge boards nvidia namely jetson tx xavier measurements distilled simple practical model provide estimate energy consumption certain inference task considered boards believe model used many contexts instance guide search efficient architectures neural architecture search heuristic neural network pruning find energyefficient offloading strategies split computing context simply evaluate energetic performance deep neural network architectures
603,renewable energies gained attention recent years since offer clean sustainable energy one major sustainable development goals sdg set united nations un achieve affordable clean energy everyone among worlds renewable resources solar energy considered abundant certainly fulfill target sdgs solar energy converted electrical energy photovoltaic pv panels greenhouse gas emissions however power generated pv panels highly dependent solar radiation received particular location given time period therefore challenging forecast amount pv output power predicting output power pv systems essential since several public private institutes generate green energy need maintain balance demand supply research aims forecast pv system output power based weather derived features using different machine learning models objective obtain bestfitting model precisely predict output power inspecting data moreover different performance metrics used compare evaluate accuracy different machine learning models random forest xgboost knn etc
606,paper addresses dire need platform efficiently provides framework running reinforcement learning rl experiments propose cairl environment toolkit efficient compatible sustainable alternative training learning agents propose methods develop efficient environment simulations increasing focus developing sustainable artificial intelligence however little effort made improve efficiency running environment simulations popular development toolkit reinforcement learning openai gym built using python powerful slow programming language propose toolkit written c flexibility level works orders magnitude faster make pythons inefficiency would drastically cut climate emissions cairl also presents first reinforcement learning toolkit builtin jvm flash support running legacy flash games reinforcement learning research demonstrate effectiveness cairl classic control benchmark comparing execution speed openai gym furthermore illustrate cairl act dropin replacement openai gym leverage significantly faster training speeds reduced environment computation time
610,rapid advances artificial intelligence ai last decade largely built upon wide applications deep learning dl however high carbon footprint yielded larger larger dl networks becomes concern sustainability furthermore dl decision mechanism somewhat obsecure verified test data green learning gl proposed alternative paradigm address concerns gl characterized low carbon footprints small model sizes low computational complexity logical transparency offers energyeffective solutions cloud centers well mobileedge devices gl also provides clear logical decisionmaking process gain peoples trust several statistical tools developed achieve goal recent years include subspace approximation unsupervised supervised representation learning supervised discriminant feature selection feature space partitioning seen successful gl examples performance comparable stateoftheart dl solutions paper offers introduction gl demonstrated applications future outlook
612,notion smart cities adapted globally provide better quality living smart citys smart mobility component focuses providing smooth safe commuting residents promotes ecofriendly sustainable alternatives public transit bus among several smart applications system provides uptotheminute information like bus arrival travel duration schedule etc improves reliability public transit services still application needs live information traffic flow accidents events location buses cities lack infrastructure provide data context bus arrival prediction model proposed forecasting arrival time using limited data sets location data public transit buses spatial characteristics used study one routes tumakuru city service tumakuru india selected divided two spatial patterns sections intersections sections without intersections machine learning model xgboost modeled spatial patterns individually model dynamically predict bus arrival time developed using preceding trip information machine learning model estimate arrival time downstream bus stop performance models compared based rsquared values predictions made proposed model established superior results suggested predict bus arrival study area proposed model also extended similar cities limited trafficrelated infrastructure
613,web today whether prefer call web web web even metaverse critical stage evolution challenge largely centered around crisis identity like teenagers assess properly reason seem ready take responsibility actions constantly blaming system trying get away truly realize benefits innovation technology crisis resolved tactical solutions developments enhance sustainability web benefits significant strides made evolution digital services enabled technology regulation sheer pace societal change journey decentralized web mirroring convergence physical digital worlds across economies increasingly embracing digital native world technology provided foundational platform individuals entities create manage wealth potentially without need big institutions ironically despite advancements still facing unprecedented increasing wealth gap clearly system broken around edges core democratic underpinning society whitepaper propose artificial intelligence blockchain used generate new class identity direct human computer interaction demonstrate combined new perspectives sustaining community governance embedded within use blockchain technology underpin sustainable solution protect identity authorship privacy time contributing restore trust amongst members future decentralized nation hence contribute solving web significant identity crisis
617,surrogate modeling brought revolution computation branches science engineering backed artificial intelligence surrogate model present highly accurate results significant reduction computation time computer simulation actual models surrogate modeling techniques found use numerous branches science engineering energy system modeling one since idea hybrid sustainable energy systems spreading rapidly modern world paradigm smart energy shift researchers exploring future application artificial intelligencebased surrogate modeling analyzing optimizing hybrid energy systems one promising technologies assessing applicability energy system digital twin leverage surrogate modeling work presents comprehensive frameworkreview artificial intelligencedriven surrogate modeling applications focus digital twin framework energy systems role machine learning artificial intelligence constructing effective surrogate model explained different surrogate models developed different sustainable energy sources presented finally digital twin surrogate models associated uncertainties described
618,smart energy performance monitoring optimisation supplier consumer levels essential realising smart cities order implement sustainable energy management plan crucial conduct better energy forecast nextgeneration smart meters also used measure record report energy consumption data used train machine learning ml models predicting energy needs however sharing finegrained energy data performing centralised learning may compromise users privacy leave vulnerable several attacks study addresses issue utilising federated learning fl emerging technique performs ml model training user level data resides introduce fedtrees new lightweight fl framework benefits outstanding features ensemble learning furthermore developed deltabased early stopping algorithm monitor fl training stop need continue simulation results demonstrate fedtrees outperforms popular federated averaging fedavg framework baseline persistence model providing accurate energy forecasting patterns taking computation time communication rounds compared fedavg saving considerable amounts computation communication resources
639,recent global growth interest smart cities led trillions dollars investment toward research development connected cities potential create symbiosis technology society revolutionize cost living safety ecological sustainability quality life societies worldwide scale key components smart city construct connected smart grids selfdriving cars federated learning systems smart utilities largescale public transit proactive surveillance systems exciting prospect technologies subsequent integration attempted without addressing potential societal impacts high degree automation data sharing additionally feasibility coordinating many disparate tasks require fast extensible unifying framework end propose faro completely reimagined successor faro built ground faro affords functionality predecessor serving unified biometric api harness allows seamless evaluation deployment simple pipeline creation heterogeneous biometric software faro additionally provides fully declarative capability defining coordinating custom machine learning sensor pipelines allowing distribution processes across otherwise incompatible hardware networks faro ultimately provides way quickly configure hotswap expand large coordinated federated systems online without interruptions maintenance much data collected smart city contains personally identifying information pii faro also provides builtin tools layers ensure secure encrypted streaming storage access pii data across distributed systems
640,recent developments artificial intelligence increase capability creation arts largely autonomous collaborative contexts contexts ai aims imitate combine extend existing artistic styles transform creative practices ongoing research investigate creativeai sustainability ethical perspectives two main focus areas understanding environmental sustainability aspects material practices context artistic processes involve creativeai ethical issues related gets involved creation process power authorship ownership paper provides outline ongoing research two directions present interdisciplinary approach combines interviews workshops online ethnography energy measurements address research questions creativeai currently used artist communities future applications artists imagine ai applied creating art might impact economy environment answers questions guide requirements intellectual property regimes creativeai
665,organizations rely machine learning engineers mles operationalize ml ie deploy maintain ml pipelines production process operationalizing ml mlops consists continual loop data collection labeling ii experimentation improve ml performance iii evaluation throughout multistaged deployment process iv monitoring performance drops production considered together responsibilities seem staggering anyone mlops unaddressed challenges implications tool builders conducted semistructured ethnographic interviews mles working across many applications including chatbots autonomous vehicles finance interviews expose three variables govern success production ml deployment velocity validation versioning summarize common practices successful ml experimentation deployment sustaining production performance finally discuss interviewees pain points antipatterns implications tool design
667,sustainable software engineering received lot attention recent times witness evergrowing slice energy use example data centers software systems utilize underlying infrastructure characterizing servers energy use accurately without intrusive therefore important make sustainable software deployment choices paper introduce esave machine learningbased approach leverages small set hardware attributes characterize server virtual machines energy usage across different levels utilization based upon extensive exploration multiple ml approaches focus minimal set required attributes showcasing good accuracy early validations show esave around average prediction error despite nonintrusive
672,exponential growth human population vital conserve natural resources without compromising producing enough food feed everyone improve peoples livelihoods health ecosystems present future generations sustainable development paradigm united nations rooted food crop livestock forest population even emission gases understanding overall usage natural resources different countries past possible forecast demand country proposed solution consists implementing machine learning system using statistical regression model predict top k products would endure shortage country specific period future prediction performance terms absolute error root mean square error show promising results due low errors solution could help organizations manufacturers understand productivity sustainability needed satisfy global demand
712,density one commonly measured estimated materials properties especially glasses melts significant interest many fields including metallurgy geology materials science sustainable cements two types machine learning ml models ie random forest rf artificial neural network ann developed predict roomtemperature density glasses compositional space caomgoalosiotiofeofeonaokomno cmastfnkm based data points mined literature studies results show rf ann models give accurate predictions glass density r values rmse mape gcm respectively testing set accurate compared empirical density models based ionic packing ratio r values rmse mape gcm respectively furthermore glass density shown reliable reactivity indicator range caoalosio cas volcanic glasses due strong correlation r values average metaloxygen dissociation energy structural descriptor glasses analysis predicted densitycomposition relationships models selected compositional subspaces suggests ann model exhibits certain level transferability ie ability extrapolate compositional space less covered database captures known features including mixed alkaline earth effects caomgoalosio glasses
