id,CleanContent
734,recent technological economic developments transformed healthcare sector towards personalized iotbased healthcare services services realized control monitoring applications typically developed using artificial intelligencemachine learningbased algorithms play significant role highlighting efficiency traditional healthcare systems current personalized healthcare services dedicated specific environment support technological personalization however unable consider different interrelated health conditions leading inappropriate diagnoses affecting sustainability longterm health patients end current healthcare technology evolved supersede previous healthcare technologies goal healthcare achieve autonomous healthcare service takes account interdependent effect different health conditions patient paper conducts comprehensive survey personalized healthcare services particular first present overview key requirements comprehensive personalized healthcare services modern healthcare internet things hiot including definition personalization example use case scenario representative modern hiot second explored fundamental threelayer architecture iotbased healthcare systems using ai nonaibased approaches considering key requirements cphs followed strengths weaknesses frame personalized healthcare services third highlighted different security threats layer iot architecture along possible ai nonaibased solutions finally propose methodology develop reliable resilient personalized healthcare services address identified weaknesses existing approaches
756,since facebook renamed meta lot attention debate exploration intensified metaverse works possible ways exploit anticipated metaverse continuum rapidly emerging technologies usecases capabilities experiences make next evolution internet several researchers already surveyed literature artificial intelligence ai wireless communications realizing metaverse however due rapid emergence continuous evolution technologies need comprehensive indepth survey role ai g nexus realizing immersive experiences metaverse therefore survey first introduce background ongoing progress augmented reality ar virtual reality vr mixed reality mr spatial computing followed technical aspects ai g survey role ai metaverse reviewing stateoftheart deep learning computer vision edge ai extract requirements g metaverse next investigate promising services bgg towards metaverse followed identifying role ai g networks g networks ai support metaverse applications need sustainability metaverse finally enlist existing potential applications usecases projects highlight importance progress metaverse moreover order provide potential research directions researchers underline challenges research gaps lessons learned identified literature review aforementioned technologies
757,proof work pow representative consensus protocol blockchain consumes enormous amounts computation energy determine bookkeeping rights among miners achieve practical purposes address drawback pow propose novel energyrecycling consensus mechanism named platformfree proof federated learning pfpofl leverages computing power originally wasted solving hard meaningless pow puzzles conduct practical federated learning fl tasks nevertheless potential security threats efficiency concerns may occur due untrusted environment miners selfinterested features paper devising novel block structure new transaction types creditbased incentives pfpofl allows efficient artificial intelligence ai task outsourcing federated mining model evaluation reward distribution fully decentralized manner resisting spoofing sybil attacks besides pfpofl equips userlevel differential privacy mechanism miners prevent implicit privacy leakage training fl models furthermore considering dynamic miner characteristics eg training samples noniid degree network delay diverse fl tasks federation formation gamebased mechanism presented distributively form optimized disjoint miner partition structure nashstable convergence extensive simulations validate efficiency effectiveness pfpofl
772,decentralized household energy system comprised various devices home appliances electric vehicles solar panels endusers able dig deeper systems details achieve energy sustainability presented data electric energy consumption production granularity device however many databases field siloed domains including solely information pertaining energy may result loss information eg weather devices energy use meanwhile large number datasets extensively used computational modeling techniques machine learning models computational approaches achieve great accuracy performance concentrating local view datasets model reliability guaranteed since models vulnerable data input fluctuations information omission taken account article tackles data isolation issue field smart energy systems examining semantic web methods top household energy system offer ontologybased approach managing decentralized data devicelevel resolution system consequence scope data associated device may easily expanded interoperable manner throughout web additional information weather obtained web provided data organized according wc standards
776,scale major driving force improving machine learning performance understanding scaling laws essential strategic planning sustainable model quality performance growth longterm resource planning developing efficient system infrastructures support largescale models paper study empirical scaling laws dlrm style recommendation models particular clickthrough rate ctr observe model quality scales power law plus constant model size data size amount compute used training characterize scaling efficiency along three different resource dimensions namely data parameters compute comparing different scaling schemes along axes show parameter scaling steam model architecture study higherperforming model architecture emerges data scaling path forward key research questions addressed study include recommendation model scale sustainably predicted scaling laws far scaling law predictions limits scaling implications scaling laws longterm hardwaresystem development
805,immersive analytics potential promote collaboration machine learning ml desired due specific characteristics ml modeling practice namely complexity ml interdisciplinary approach industry need ml interpretability work introduce augmented realitybased system collaborative immersive analytics designed support ml modeling interdisciplinary teams conduct user study examine collaboration unfolds users different professional backgrounds levels ml knowledge interact solving different ml tasks specifically use pair analytics methodology performance assessments assess collaboration explore interactions system based provide qualitative quantitative results teamwork taskwork collaboration results show system elicits sustained collaboration measured along six distinct dimensions finally make recommendations immersive systems designed elicit sustained collaboration ml modeling
811,acceleration urbanisation posing great challenges sustainable development growing accessibility big data artificial intelligence ai technologies revolutionised many fields offered great potential addressing pressing urban problems however using technologies without explicitly considering responsibilities would bring new societal environmental issues fully harness potential big data ai without creating new problems envisage conceptual framework responsible urban intelligence rui advocate agenda action first define rui consisting three major components including urban problems enabling technologies responsibilities introduce transparency fairness ecofriendliness three dimensions responsibilities naturally link human space time dimensions cities develop fourstage implementation framework responsibilities consisting solution design data preparation model building practical application finally present research agenda rui addressing challenging issues including data model transparency tension performance fairness solving urban problems ecofriendly manner
815,recent cyber attacks credential theft emerged one primary vectors gaining entry system attackers foothold system use various techniques including token manipulation elevate privileges access protected resources makes authentication token based authorization critical component secure resilient cyber system paper discuss design considerations secure resilient authentication authorization framework capable selfadapting based risk scores trust profiles compare design existing standards oauth openid connect saml study popular threat models stride pasta summarize resilience proposed architecture common relevant threat vectors call framework resilient risk based adaptive authentication authorization radaa proposed framework excessively increases cost adversary launch sustain cyber attack provides muchneeded strength critical infrastructure also discuss machine learning ml approach adaptive engine accurately classify transactions arrive risk scores
816,ensemble learning gained success machine learning major advantages learning methods bagging prominent ensemble learning method creates subgroups data known bags trained individual machine learning methods decision trees random forest prominent example bagging additional features learning process evolutionary algorithms prominent optimisation problems also used machine learning evolutionary algorithms gradientfree methods work population candidate solutions maintain diversity creating new solutions conventional bagged ensemble learning bags created content terms training examples fixed learning process paper propose evolutionary bagged ensemble learning utilise evolutionary algorithms evolve content bags order iteratively enhance ensemble providing diversity bags results show evolutionary ensemble bagging method outperforms conventional ensemble methods bagging random forests several benchmark datasets certain constraints find evolutionary bagging inherently sustain diverse set bags without reduction performance accuracy
817,maintaining farm sustainability optimizing agricultural management practices helps build planetfriendly environment emerging satellite missions acquire multi hyperspectral imagery captures detailed spectral information concerning scanned area hence allows us benefit subtle spectral features analysis process agricultural applications introduce approach extracting cultivated land maps sentinel multispectral image series benefits compact graph convolutional neural network experiments indicate models outperform classical deep machine learning techniques delivering higherquality segmentation maps also dramatically reduce memory footprint compared unets almost k trainable parameters models parameters unets memory frugality pivotal missions allow us uplink model aipowered satellite orbit sending large nets impossible due time constraints
820,aggregate ability child care providers meet local demand child care linked employment rates many sectors economy amid growing concern regarding child care provider sustainability due covid pandemic state local governments received large amounts new funding better support provider stability response new funding aimed bolstering child care market florida study devised exploratory investigation features child care providers lead business longevity study used optimal survival trees machine learning technique designed better understand providers expected remain operational longer periods time supporting stabilization child care market treebased survival analysis detects describes complex interactions provider characteristics lead differences expected business survival rates results show small providers religiously affiliated providers serving children floridas universal prekindergarten program andor children using child care subsidy likely longest expected survival rates
831,computers today arent confined laptops desktops mobile gadgets like mobile phones laptops also make use however one input device hasnt changed last years qwerty keyboard users virtual keyboards type surface keyboard thanks sensor technology artificial intelligence research use idea image processing create application seeing computer keyboard using novel framework detect hand gestures precise accuracy also sustainable financially viable camera used capture keyboard images finger movements subsequently acts virtual keyboard addition visible virtual mouse accepts finger coordinates input also described study system direct benefit reducing peripheral cost reducing electronics waste generated due external devices providing accessibility people use traditional keyboard mouse
836,crownofthorn starfish cots outbreaks major cause coral loss great barrier reef gbr substantial surveillance control programs ongoing manage cots populations ecologically sustainable levels paper present comprehensive realtime machine learningbased underwater data collection curation system edge devices cots monitoring particular leverage power deep learningbased object detection techniques propose resourceefficient cots detector performs detection inferences edge device assist marine experts cots identification data collection phase preliminary results show several strategies improving computational efficiency eg batchwise processing frame skipping model input size combined run proposed detection model edge hardware low resource consumption low information loss
848,management people longterm chronic illness one biggest challenges national health systems fact diseases among leading causes hospitalization especially elderly huge amount resources required monitor leads problems sustainability healthcare systems increasing diffusion portable devices new connectivity technologies allows implementation telemonitoring system capable providing support health care providers lighten burden hospitals clinics paper present implementation telemonitoring platform healthcare designed capture several types physiological health parameters different consumer mobile custom devices consumer medical devices integrated platform via google fit ecosystem supports hundreds devices custom devices directly interact platform standard communication protocols platform designed process acquired data using machine learning algorithms provide patients physicians physiological health parameters userfriendly comprehensive easy understand dashboard monitors parameters time preliminary usability tests show good user satisfaction terms functionality usefulness
852,training machine learning models massive datasets incurs substantial computational costs alleviate costs sustained effort develop dataefficient training methods carefully select subsets training examples generalize par full training data however existing methods limited providing theoretical guarantees quality models trained extracted subsets may perform poorly practice propose adacore method leverages geometry data extract subsets training examples efficient machine learning key idea behind method dynamically approximate curvature loss function via exponentiallyaveraged estimate hessian select weighted subsets coresets provide close approximation full gradient preconditioned hessian prove rigorous guarantees convergence various first secondorder methods applied subsets chosen adacore extensive experiments show adacore extracts coresets higher quality compared baselines speeds training convex nonconvex machine learning models logistic regression neural networks x full data x random subsets
872,optimizing production yield limiting negative environmental impact sustainable agriculture benefits greatly realtime onthespot analysis soil low cost colorimetric paper sensors ideal candidates cheap rapid chemical spot testing however field application requires previously unattained paper sensor reliability automated readout analysis means integrated mobile communication artificial intelligence cloud computing technologies report mobile chemical analysis system based colorimetric paper sensors operates tropical field conditions mapping topsoil ph field area hectares benchmarked mobile system precision agriculture standards following protocol reference analysis compound soil samples compared routine lab analysis mobile soil analysis system correctly classified soil ph cases reducing analysis turnaround time days minutes moreover performing onthespot analyses individual compound subsamples field achieved fold increase spatial resolution reveals phvariations detectable compound mapping mode mobile system extended perform multiparameter chemical tests soil nutrients applications environmental monitoring marginal manufacturing cost
884,powered advances deep learning dl techniques machine learning artificial intelligence achieved astonishing successes however rapidly growing needs dl also led communication resourceintensive distributed training jobs largescale dl training typically deployed gpu clusters sustain everincreasing demand dl training socalled ringallreduce rar technologies recently emerged favorable computing architecture efficiently process network communication computation load gpu clusters salient feature rar removes need dedicated parameter servers thus alleviating potential communication bottleneck however multiple rarbased dl training jobs deployed gpu clusters communication bottlenecks could still occur due contentions dl training jobs far remains lack theoretical understanding design contentionaware resource scheduling algorithms rarbased dl training jobs motivates us fill gap work main contributions threefold develop new analytical model characterizes communication overhead related worker distribution job communication contention related colocation different jobs ii based proposed analytical model formulate problem nonconvex integer program minimize makespan rarbased dl training jobs address unique structure problem amenable optimization algorithm design reformulate problem integer linear program enables provable approximation algorithm design called sjfbco smallest job first balanced contention overhead iii conduct extensive experiments show superiority sjfbco existing schedulers
886,twoparty machine learning prediction services clients goal query remote servers trained machine learning model perform neural network inference application domain however sensitive information obtained process either client server leading potential collection unauthorized secondary use inappropriate access personal information security concerns given rise private inference pi clients personal data servers trained model kept confidential stateoftheart pi protocols consist preprocessing offline phase online phase combine several cryptographic primitives homomorphic encryption secret sharing ss garbled circuits gc oblivious transfer ot despite need recent performance improvements pi remains largely arcane today slow practical use paper addresses pis shortcomings detailed characterization standard highperformance protocol build foundational knowledge intuition systems community characterization pinpoints sources inefficiency compute communication storage contrast prior work consider inference request arrival rates rather studying individual inferences isolation find preprocessing phase ignored often incurred online insufficient downtime hide precompute latency finally leverage insights characterization propose three optimizations address storage clientgarbler computation layerparallel communication wireless slot allocation overheads compared stateoftheart pi protocol optimizations provide total pi speedup times ability sustain inference requests times greater rate
900,nuclear fusion represents one best alternatives sustainable source clean energy tokamaks allow confine fusion plasma magnetic fields one main challenges control magnetic configuration predictionreconstruction last closedflux surface lcfs evolution time lcfs determined interaction actuator coils internal tokamak plasma task requires realtime capable tools able deal highdimensional data well high resolution time interaction wide range input actuator coils internal plasma state responses add additional layer complexity work present application novel state art machine learning model lcfs reconstruction experimental advanced superconducting tokamak east learns automatically experimental data east architecture allows offline simulation testing particular control strategy also embedded realtime control system online magnetic equilibrium reconstruction prediction realtime modeling test approach achieves high accuracies average similarity lcfs reconstruction entire discharge process
906,internetofvehicle iov facilitate seamless connectivity connected vehicles cv autonomous vehicles av iov entities intrusion detection systems idss iov networks rely machine learning ml protect invehicle network cyberattacks blockchainbased federated forests bffs could used train ml models based data iov entities protecting confidentiality data reducing risks tampering data however ml models created way still vulnerable evasion poisoning exploratory attacks using adversarial examples paper investigates impact various possible adversarial examples bffids proposed integrating statistical detector detect extract unknown adversarial samples including unknown detected samples dataset detector augment bffids additional model detect original known attacks new adversarial inputs statistical adversarial detector confidently detected adversarial examples sample size input samples furthermore augmented bffids bffidsaug successfully mitigates adversarial examples accuracy approach model continue augmented sandbox whenever adversarial sample detected subsequently adopt bffidsaug active security model consequently proposed integration statistical adversarial detector subsequent augmentation bffids detected adversarial samples provides sustainable security framework adversarial examples unknown attacks
923,continuous developments data science brought forth exponential increase complexity machine learning models additionally data scientists become ubiquitous private market academic environments even hobby trends steady rise associated increase power consumption associated carbon footprint increasing carbon footprint largescale advanced data science already received attention latter trend work aims estimate contribution increasingly popular common data science global carbon footprint end power consumption several typical tasks aforementioned common data science tasks measured compared largescale advanced data science common computerrelated tasks everyday noncomputer related tasks done converting measurements equivalent unit km driven car main findings common data science consumes power regular computer usage less common everyday powerconsuming tasks lighting heating largescale data science consumes substantially power common data science
929,edge computing popular target accelerating machine learning algorithms supporting mobile devices without requiring communication latencies handle cloud edge deployments machine learning primarily consider traditional concerns swap constraints size weight power installations however metrics entirely sufficient consider environmental impacts computing given significant contributions embodied energy carbon paper explore tradeoffs convolutional neural network acceleration engines inference online training particular explore use processinginmemory pim approaches mobile gpu accelerators recently released fpgas compare novel racetrack memory pim replacing pimenabled ddr racetrack memory pim recover embodied energy quickly year high activity ratios mobile gpus sustainable higher embodied energy overcome compared pimenabled racetrack memory
930,increasing concerns raised deep learning fairness recent years existing fairnessaware machine learning methods mainly focus fairness indistribution data however realworld applications common distribution shift training test data paper first show fairness achieved existing methods easily broken slight distribution shifts solve problem propose novel fairness learning method termed curvature matching cuma achieve robust fairness generalizable unseen domains unknown distributional shifts specifically cuma enforces model similar generalization ability majority minority groups matching loss curvature distributions two groups evaluate method three popular fairness datasets compared existing methods cuma achieves superior fairness unseen distribution shifts without sacrificing either overall accuracy indistribution fairness
